### ISSUE TITLE
Problem when running ecal_sample_person_snd and rec on dual hosts if they have smae host name 

### ISSUE THREAD

**Issue by liyue75** [continental/ecal#157]
Hi, I'm learning ecal recently and starting with getting started.
When I followed the instructions here [https://continental.github.io/ecal/getting_started/cloud.html](url), a problem occured:
After adding route on both hosts, I start  ecal_sample_person_snd on one host and the pub start sending samples, 
but on other host, I enter: ecal_sample_person_rec, it returns:
 **shm_open failed : /person_105927161308_shm error: No such file or directory**.
I use tcpdump to catch packets on the sub's ethernet card, here is the result:

>  12:57:40.035944 IP 192.168.1.6.52232 > 239.0.0.1.14000: UDP, length 218
12:57:40.036713 IP 192.168.1.6.52232 > 239.0.0.1.14000: UDP, length 173
12:57:40.036794 IP 192.168.1.6.52232 > 239.0.0.1.14000: UDP, length 173
12:57:40.259640 IP 192.168.1.5.52577 > 239.0.0.1.14000: UDP, length 249
12:57:40.260892 IP 192.168.1.5.52577 > 239.0.0.1.14000: UDP, length 597
12:57:40.299169 IP 192.168.1.6.49360 > 239.0.0.1.14000: UDP, length 248
12:57:40.300767 IP 192.168.1.6.49360 > 239.0.0.1.14000: UDP, length 643
12:57:41.037483 IP 192.168.1.6.52232 > 239.0.0.1.14000: UDP, length 218
12:57:41.038999 IP 192.168.1.6.52232 > 239.0.0.1.14000: UDP, length 173
12:57:41.039028 IP 192.168.1.6.52232 > 239.0.0.1.14000: UDP, length 173
12:57:41.261403 IP 192.168.1.5.52577 > 239.0.0.1.14000: UDP, length 249
12:57:41.262779 IP 192.168.1.5.52577 > 239.0.0.1.14000: UDP, length 597
12:57:41.301039 IP 192.168.1.6.49360 > 239.0.0.1.14000: UDP, length 248
12:57:41.303116 IP 192.168.1.6.49360 > 239.0.0.1.14000: UDP, length 643
^C

The pub's ip is 192.168.1.6, and the sub's is 192.168.1.5, and they have the same host name:liyue-ThinkPad-T470-W10DG.

And I use ecal_mon_gui on pub host to look for more information:
![ex](https://user-images.githubusercontent.com/53389739/104083810-b3bf1980-527c-11eb-86f5-64918f0fbde2.png)

The monitor place the pub and sub under the same host liyue-ThinkPad-T470-W10DG. 

I can catch UDP packets on network, but the sub ask for shm file. Is that means: because the hostname is the same, so the program treat pub and sub as processes on the same host?

And if I change the sub's hostname to something else, then it can receive the messages from the pub. Shouldn' t hosts be distinguished by their IP address instead of hostname?

**Comment by rex-schilasky** [comment]
Hi, currently eCAL is sorting entities (publisher, subscriber, server, clients) by host_name/process_id/(pub|sub)_id. There are different reasons to not use IP address but host names. Services for example relies on different host names and will not work in such a setup. So best practice is to use different host names for every network device.
The strange effect (can not open memory file) that you noticed is based on the wrong assumption of the person subscriber that the publisher is running on the same host and so a shared memory file should exist for local host communication. In fact this memory file exists on the publishers host (with the same name ;-)).

**Comment by liyue75** [comment]
Thank you for your reply,@rex-schilasky.
